{
  "schemaVersion": "1.0.0",
  "metadata": {
    "courseId": "course-bio101",
    "lectureId": "lecture-03",
    "noteId": "note-cell-membrane",
    "pageId": "page-1",
    "createdAt": "2026-10-07T16:35:08.602Z",
    "updatedAt": "2026-10-07T16:35:32.098Z",
    "exportedAt": "2026-10-07T16:35:32.098Z",
    "language": "en-US",
    "source": {
      "app": "harness",
      "platform": "web",
      "inputDevice": "pen"
    },
    "canvas": {
      "width": 606,
      "height": 254,
      "units": "px"
    }
  },
  "strokes": [
    {
      "strokeId": "s_0001",
      "points": [
        {
          "x": 120,
          "y": 140,
          "t": 0,
          "p": 0.35
        },
        {
          "x": 125,
          "y": 110,
          "t": 17,
          "p": 0.547
        },
        {
          "x": 130,
          "y": 140,
          "t": 31,
          "p": 0.647
        },
        {
          "x": 135,
          "y": 110,
          "t": 44,
          "p": 0.602
        },
        {
          "x": 140,
          "y": 140,
          "t": 57,
          "p": 0.434
        }
      ],
      "bbox": {
        "x": 120,
        "y": 110,
        "w": 20,
        "h": 30
      },
      "style": {
        "strokeWidth": 2,
        "color": "#1e1e1e"
      }
    },
    {
      "strokeId": "s_0002",
      "points": [
        {
          "x": 146,
          "y": 140,
          "t": 132,
          "p": 0.187
        },
        {
          "x": 151,
          "y": 110,
          "t": 149,
          "p": 0.062
        },
        {
          "x": 156,
          "y": 140,
          "t": 163,
          "p": 0.077
        },
        {
          "x": 161,
          "y": 110,
          "t": 175,
          "p": 0.226
        },
        {
          "x": 166,
          "y": 140,
          "t": 188,
          "p": 0.435
        }
      ],
      "bbox": {
        "x": 146,
        "y": 110,
        "w": 20,
        "h": 30
      },
      "style": {
        "strokeWidth": 2,
        "color": "#1e1e1e"
      }
    },
    {
      "strokeId": "s_0003",
      "points": [
        {
          "x": 172,
          "y": 140,
          "t": 264,
          "p": 0.623
        },
        {
          "x": 177,
          "y": 110,
          "t": 281,
          "p": 0.638
        },
        {
          "x": 182,
          "y": 140,
          "t": 294,
          "p": 0.511
        },
        {
          "x": 187,
          "y": 110,
          "t": 307,
          "p": 0.306
        },
        {
          "x": 192,
          "y": 140,
          "t": 320,
          "p": 0.122
        }
      ],
      "bbox": {
        "x": 172,
        "y": 110,
        "w": 20,
        "h": 30
      },
      "style": {
        "strokeWidth": 2,
        "color": "#1e1e1e"
      }
    },
    {
      "strokeId": "s_0004",
      "points": [
        {
          "x": 240,
          "y": 140,
          "t": 398,
          "p": 0.053
        },
        {
          "x": 245,
          "y": 110,
          "t": 416,
          "p": 0.099
        },
        {
          "x": 250,
          "y": 140,
          "t": 428,
          "p": 0.268
        },
        {
          "x": 255,
          "y": 110,
          "t": 441,
          "p": 0.477
        },
        {
          "x": 260,
          "y": 140,
          "t": 454,
          "p": 0.624
        }
      ],
      "bbox": {
        "x": 240,
        "y": 110,
        "w": 20,
        "h": 30
      },
      "style": {
        "strokeWidth": 2,
        "color": "#1e1e1e"
      }
    },
    {
      "strokeId": "s_0005",
      "points": [
        {
          "x": 266,
          "y": 140,
          "t": 531,
          "p": 0.622
        },
        {
          "x": 271,
          "y": 110,
          "t": 548,
          "p": 0.472
        },
        {
          "x": 276,
          "y": 140,
          "t": 561,
          "p": 0.263
        },
        {
          "x": 281,
          "y": 110,
          "t": 574,
          "p": 0.096
        },
        {
          "x": 286,
          "y": 140,
          "t": 588,
          "p": 0.053
        }
      ],
      "bbox": {
        "x": 266,
        "y": 110,
        "w": 20,
        "h": 30
      },
      "style": {
        "strokeWidth": 2,
        "color": "#1e1e1e"
      }
    },
    {
      "strokeId": "s_0006",
      "points": [
        {
          "x": 292,
          "y": 140,
          "t": 665,
          "p": 0.19
        },
        {
          "x": 297,
          "y": 110,
          "t": 682,
          "p": 0.396
        },
        {
          "x": 302,
          "y": 140,
          "t": 696,
          "p": 0.579
        },
        {
          "x": 307,
          "y": 110,
          "t": 709,
          "p": 0.65
        },
        {
          "x": 312,
          "y": 140,
          "t": 722,
          "p": 0.575
        }
      ],
      "bbox": {
        "x": 292,
        "y": 110,
        "w": 20,
        "h": 30
      },
      "style": {
        "strokeWidth": 2,
        "color": "#1e1e1e"
      }
    },
    {
      "strokeId": "s_0007",
      "points": [
        {
          "x": 318,
          "y": 140,
          "t": 797,
          "p": 0.347
        },
        {
          "x": 323,
          "y": 110,
          "t": 814,
          "p": 0.151
        },
        {
          "x": 328,
          "y": 140,
          "t": 827,
          "p": 0.053
        },
        {
          "x": 333,
          "y": 110,
          "t": 841,
          "p": 0.1
        },
        {
          "x": 338,
          "y": 140,
          "t": 854,
          "p": 0.269
        }
      ],
      "bbox": {
        "x": 318,
        "y": 110,
        "w": 20,
        "h": 30
      },
      "style": {
        "strokeWidth": 2,
        "color": "#1e1e1e"
      }
    },
    {
      "strokeId": "s_0008",
      "points": [
        {
          "x": 120,
          "y": 200,
          "t": 928,
          "p": 0.35
        },
        {
          "x": 125,
          "y": 170,
          "t": 946,
          "p": 0.547
        },
        {
          "x": 130,
          "y": 200,
          "t": 960,
          "p": 0.647
        },
        {
          "x": 135,
          "y": 170,
          "t": 974,
          "p": 0.602
        },
        {
          "x": 140,
          "y": 200,
          "t": 988,
          "p": 0.434
        }
      ],
      "bbox": {
        "x": 120,
        "y": 170,
        "w": 20,
        "h": 30
      },
      "style": {
        "strokeWidth": 2,
        "color": "#1e1e1e"
      }
    },
    {
      "strokeId": "s_0009",
      "points": [
        {
          "x": 146,
          "y": 200,
          "t": 1063,
          "p": 0.187
        },
        {
          "x": 151,
          "y": 170,
          "t": 1079,
          "p": 0.062
        },
        {
          "x": 156,
          "y": 200,
          "t": 1092,
          "p": 0.077
        },
        {
          "x": 161,
          "y": 170,
          "t": 1106,
          "p": 0.226
        },
        {
          "x": 166,
          "y": 200,
          "t": 1119,
          "p": 0.435
        }
      ],
      "bbox": {
        "x": 146,
        "y": 170,
        "w": 20,
        "h": 30
      },
      "style": {
        "strokeWidth": 2,
        "color": "#1e1e1e"
      }
    },
    {
      "strokeId": "s_0010",
      "points": [
        {
          "x": 235,
          "y": 125,
          "t": 2111,
          "p": 0.152
        },
        {
          "x": 245,
          "y": 125,
          "t": 2128,
          "p": 0.099
        },
        {
          "x": 255,
          "y": 125,
          "t": 2141,
          "p": 0.477
        },
        {
          "x": 265,
          "y": 125,
          "t": 2154,
          "p": 0.637
        },
        {
          "x": 275,
          "y": 125,
          "t": 2166,
          "p": 0.305
        },
        {
          "x": 285,
          "y": 125,
          "t": 2179,
          "p": 0.05
        },
        {
          "x": 295,
          "y": 125,
          "t": 2193,
          "p": 0.31
        },
        {
          "x": 305,
          "y": 125,
          "t": 2206,
          "p": 0.639
        },
        {
          "x": 315,
          "y": 125,
          "t": 2219,
          "p": 0.472
        },
        {
          "x": 325,
          "y": 125,
          "t": 2232,
          "p": 0.096
        },
        {
          "x": 335,
          "y": 125,
          "t": 2245,
          "p": 0.156
        }
      ],
      "bbox": {
        "x": 235,
        "y": 125,
        "w": 100,
        "h": 0
      },
      "style": {
        "strokeWidth": 2,
        "color": "#1e1e1e"
      }
    }
  ],
  "structure": {
    "blocks": [
      {
        "blockId": "b_01",
        "type": "text",
        "bbox": {
          "x": 120,
          "y": 110,
          "w": 218,
          "h": 90
        },
        "lines": [
          {
            "lineId": "l_001",
            "strokeIds": [
              "s_0001",
              "s_0002",
              "s_0003",
              "s_0004",
              "s_0005",
              "s_0006",
              "s_0007",
              "s_0010"
            ],
            "bbox": {
              "x": 120,
              "y": 110,
              "w": 218,
              "h": 30
            },
            "recognitionId": null
          },
          {
            "lineId": "l_002",
            "strokeIds": [
              "s_0008",
              "s_0009"
            ],
            "bbox": {
              "x": 120,
              "y": 170,
              "w": 46,
              "h": 30
            },
            "recognitionId": null
          }
        ]
      }
    ]
  },
  "recognition": {
    "status": "notRecognized",
    "engine": null,
    "error": null,
    "results": []
  },
  "gestures": [],
  "groundTruth": {
    "label": "abc defg hi (defg struck out)"
  }
}
